{
  "measurement_refusal_output_set_id": "measurement-refusal-output-fixture-v0",
  "schema_id": "measurement-refusal-output-schema-v0",
  "title": "Measurement Refusal Output Fixture v0",
  "disease_program": "multiple-myeloma",
  "fixture_status": "synthetic-only-public-v0",
  "clinical_use_boundary": [
    "not-medical-advice",
    "not-diagnostic",
    "not-treatment-recommendation",
    "not-trial-recommendation",
    "research-use-only"
  ],
  "data_boundary": {
    "uses_real_case_data": false,
    "contains_identifiers": false,
    "contains_raw_records": false,
    "contains_uploads": false,
    "contains_exact_person_linked_dates": false,
    "contains_free_text_case_details": false,
    "contains_private_correspondence": false,
    "contains_model_weights": false,
    "contains_predictions": false,
    "contains_recommendations": false,
    "contains_matching_or_ranking": false,
    "contains_clinical_decisions": false
  },
  "source_fixture_set_id": "measurement-state-refusal-fixtures-v0",
  "shared_blocked_downstream_uses": [
    "diagnosis",
    "prognosis",
    "endpoint_interpretation",
    "mrd_interpretation",
    "residual_disease_comparison",
    "monitoring_guidance",
    "treatment_guidance",
    "trial_guidance",
    "patient_matching",
    "assay_ranking",
    "modality_ranking",
    "evidence_ranking",
    "clinical_decision",
    "publication_authorization",
    "cure_claim",
    "report_interpretation",
    "lab_validity_conclusion",
    "image_interpretation",
    "biopsy_interpretation"
  ],
  "outputs": [
    {
      "output_id": "mro_00_method_family_missing_v0",
      "source_fixture_id": "msrf_00_method_family_missing_v0",
      "source_checklist_row_id": "asq_00_method_family_missing",
      "output_family": "measurement_state_refusal",
      "output_status": "refused",
      "clinical_use_boundary": "research-use-only",
      "wrapper_state": "assay_specimen_quality_needed",
      "assay_specimen_quality_state": "method_family_needed",
      "refusal_reason": "method_family_needed",
      "public_processing_allowed": true,
      "comparison_allowed": false,
      "clinical_output_allowed": false,
      "limitation_note_required": true,
      "no_interpretive_text": true,
      "blocked_downstream_uses": [
        "diagnosis",
        "prognosis",
        "endpoint_interpretation",
        "mrd_interpretation",
        "residual_disease_comparison",
        "monitoring_guidance",
        "treatment_guidance",
        "trial_guidance",
        "patient_matching",
        "assay_ranking",
        "modality_ranking",
        "evidence_ranking",
        "clinical_decision",
        "publication_authorization",
        "cure_claim",
        "report_interpretation",
        "lab_validity_conclusion",
        "image_interpretation",
        "biopsy_interpretation"
      ]
    },
    {
      "output_id": "mro_01_threshold_or_detection_limit_missing_v0",
      "source_fixture_id": "msrf_01_threshold_or_detection_limit_missing_v0",
      "source_checklist_row_id": "asq_01_threshold_or_detection_limit_missing",
      "output_family": "measurement_state_refusal",
      "output_status": "refused",
      "clinical_use_boundary": "research-use-only",
      "wrapper_state": "assay_specimen_quality_needed",
      "assay_specimen_quality_state": "threshold_needed",
      "refusal_reason": "threshold_needed",
      "public_processing_allowed": true,
      "comparison_allowed": false,
      "clinical_output_allowed": false,
      "limitation_note_required": true,
      "no_interpretive_text": true,
      "blocked_downstream_uses": [
        "diagnosis",
        "prognosis",
        "endpoint_interpretation",
        "mrd_interpretation",
        "residual_disease_comparison",
        "monitoring_guidance",
        "treatment_guidance",
        "trial_guidance",
        "patient_matching",
        "assay_ranking",
        "modality_ranking",
        "evidence_ranking",
        "clinical_decision",
        "publication_authorization",
        "cure_claim",
        "report_interpretation",
        "lab_validity_conclusion",
        "image_interpretation",
        "biopsy_interpretation"
      ]
    },
    {
      "output_id": "mro_02_specimen_source_or_quality_missing_v0",
      "source_fixture_id": "msrf_02_specimen_source_or_quality_missing_v0",
      "source_checklist_row_id": "asq_02_specimen_source_or_quality_missing",
      "output_family": "measurement_state_refusal",
      "output_status": "refused",
      "clinical_use_boundary": "research-use-only",
      "wrapper_state": "assay_specimen_quality_needed",
      "assay_specimen_quality_state": "specimen_quality_needed",
      "refusal_reason": "specimen_quality_needed",
      "public_processing_allowed": true,
      "comparison_allowed": false,
      "clinical_output_allowed": false,
      "limitation_note_required": true,
      "no_interpretive_text": true,
      "blocked_downstream_uses": [
        "diagnosis",
        "prognosis",
        "endpoint_interpretation",
        "mrd_interpretation",
        "residual_disease_comparison",
        "monitoring_guidance",
        "treatment_guidance",
        "trial_guidance",
        "patient_matching",
        "assay_ranking",
        "modality_ranking",
        "evidence_ranking",
        "clinical_decision",
        "publication_authorization",
        "cure_claim",
        "report_interpretation",
        "lab_validity_conclusion",
        "image_interpretation",
        "biopsy_interpretation"
      ]
    },
    {
      "output_id": "mro_03_timepoint_alignment_missing_v0",
      "source_fixture_id": "msrf_03_timepoint_alignment_missing_v0",
      "source_checklist_row_id": "asq_03_timepoint_alignment_missing",
      "output_family": "measurement_state_refusal",
      "output_status": "refused",
      "clinical_use_boundary": "research-use-only",
      "wrapper_state": "assay_specimen_quality_needed",
      "assay_specimen_quality_state": "timepoint_alignment_needed",
      "refusal_reason": "timepoint_alignment_needed",
      "public_processing_allowed": true,
      "comparison_allowed": false,
      "clinical_output_allowed": false,
      "limitation_note_required": true,
      "no_interpretive_text": true,
      "blocked_downstream_uses": [
        "diagnosis",
        "prognosis",
        "endpoint_interpretation",
        "mrd_interpretation",
        "residual_disease_comparison",
        "monitoring_guidance",
        "treatment_guidance",
        "trial_guidance",
        "patient_matching",
        "assay_ranking",
        "modality_ranking",
        "evidence_ranking",
        "clinical_decision",
        "publication_authorization",
        "cure_claim",
        "report_interpretation",
        "lab_validity_conclusion",
        "image_interpretation",
        "biopsy_interpretation"
      ]
    },
    {
      "output_id": "mro_04_paired_modality_context_missing_v0",
      "source_fixture_id": "msrf_04_paired_modality_context_missing_v0",
      "source_checklist_row_id": "asq_04_paired_modality_context_missing",
      "output_family": "measurement_state_refusal",
      "output_status": "refused",
      "clinical_use_boundary": "research-use-only",
      "wrapper_state": "assay_specimen_quality_needed",
      "assay_specimen_quality_state": "paired_modality_context_needed",
      "refusal_reason": "paired_modality_context_needed",
      "public_processing_allowed": true,
      "comparison_allowed": false,
      "clinical_output_allowed": false,
      "limitation_note_required": true,
      "no_interpretive_text": true,
      "blocked_downstream_uses": [
        "diagnosis",
        "prognosis",
        "endpoint_interpretation",
        "mrd_interpretation",
        "residual_disease_comparison",
        "monitoring_guidance",
        "treatment_guidance",
        "trial_guidance",
        "patient_matching",
        "assay_ranking",
        "modality_ranking",
        "evidence_ranking",
        "clinical_decision",
        "publication_authorization",
        "cure_claim",
        "report_interpretation",
        "lab_validity_conclusion",
        "image_interpretation",
        "biopsy_interpretation"
      ]
    },
    {
      "output_id": "mro_05_imaging_criteria_missing_v0",
      "source_fixture_id": "msrf_05_imaging_criteria_missing_v0",
      "source_checklist_row_id": "asq_05_imaging_criteria_missing",
      "output_family": "measurement_state_refusal",
      "output_status": "refused",
      "clinical_use_boundary": "research-use-only",
      "wrapper_state": "assay_specimen_quality_needed",
      "assay_specimen_quality_state": "imaging_context_needed",
      "refusal_reason": "imaging_context_needed",
      "public_processing_allowed": true,
      "comparison_allowed": false,
      "clinical_output_allowed": false,
      "limitation_note_required": true,
      "no_interpretive_text": true,
      "blocked_downstream_uses": [
        "diagnosis",
        "prognosis",
        "endpoint_interpretation",
        "mrd_interpretation",
        "residual_disease_comparison",
        "monitoring_guidance",
        "treatment_guidance",
        "trial_guidance",
        "patient_matching",
        "assay_ranking",
        "modality_ranking",
        "evidence_ranking",
        "clinical_decision",
        "publication_authorization",
        "cure_claim",
        "report_interpretation",
        "lab_validity_conclusion",
        "image_interpretation",
        "biopsy_interpretation"
      ]
    },
    {
      "output_id": "mro_06_spatial_site_sampling_missing_v0",
      "source_fixture_id": "msrf_06_spatial_site_sampling_missing_v0",
      "source_checklist_row_id": "asq_06_spatial_site_sampling_missing",
      "output_family": "measurement_state_refusal",
      "output_status": "refused",
      "clinical_use_boundary": "research-use-only",
      "wrapper_state": "assay_specimen_quality_needed",
      "assay_specimen_quality_state": "spatial_sampling_context_needed",